{
  "case": "H033",
  "losses": [
    {
      "action": "Conservar CORTEX o HCORTEX-CANONICAL.",
      "category": "structure",
      "code": "L410_GLOSSARY_COLLAPSED",
      "detail": "El glosario completo no se emite en READABLE.",
      "path": "/$0",
      "recoverability": "from-source-only",
      "severity": "loss"
    },
    {
      "action": "No compilar READABLE como canon.",
      "category": "identity",
      "code": "L411_MACHINE_METADATA_REMOVED",
      "detail": "Se omite metadata de reconstrucción.",
      "path": "/sections/*/ideas/*",
      "recoverability": "from-source-only",
      "severity": "loss"
    }
  ],
  "mode": "readable",
  "operation": "render",
  "preserved": [
    "human-content",
    "section-sequence",
    "idea-sequence"
  ],
  "reversible": false,
  "schema_version": "0.1",
  "source_format": "cortex-0.1",
  "source_sha256": "2157058f0444e7799d67a4094c7937ee3efbd0fbbc8fcf285cabcf57be483270",
  "structural_equivalence": false,
  "target_format": "hcortex-0.1",
  "target_sha256": "1b3da08d2c58890bca0cd1e8b5fa6bccf840ada7765b188825e252fc665c76e8",
  "warnings": [
    {
      "action": "Usar CANONICAL para roundtrip.",
      "category": "lexeme",
      "code": "W412_DISPLAY_NORMALIZED",
      "detail": "Valores se muestran para lectura, no como lexemas canónicos.",
      "path": "/sections/*",
      "recoverability": "not-applicable",
      "severity": "warning"
    }
  ]
}
